<!ELEMENT REPORTCARD (STUDENT*)>
<!ELEMENT STUDENT (FNAME, LNAME, COURSE*)>
<!ELEMENT COURSE (MARK, SECTION, COURSENAME)>
<!ELEMENT FNAME (#PCDATA)>
<!ELEMENT LNAME (#PCDATA)>
<!ELEMENT MARK (#PCDATA)>
<!ELEMENT SECTION (#PCDATA)>
<!ELEMENT COURSENAME (#PCDATA)>
